N_patente;Nombre_comercio;Id_persona;Aprobacion;Categoria;Actividad;Permiso_salud;Vigencia_permiso_salud;Tipo_rotulo;Dimension;Rotulo;Provincia;Lic_licor;Codigo_actividad;Nogis;N_finca;F_real;Derecho;Direccion_comercio;Filial;N_plano_catastro;Tipo_persona;Distrito;Canton
643;JCHA DE SANTA ANA ;15954;5/2/2007 00:00;COM;VENTA DE REPUESTOS, REPARACION LLANTAS, CAMBIO ACEITE Y LAVADO VEHICULOS.;643;15/4/2022 00:00;;0;1;1;;1219;121075000;560559;;0;DE LA INTERSECCION DE RUTA NACIONAL 311 CON AVENIDA 02, 227 MTS. AL ESTE. ;;1-865527-2003;J;SANTA ANA;SANTA ANA
647;SODA CHELY;658;1/1/1900 00:00;COM;SODA;647;;;0;0;1;;899;127009000;114317;;0;DEL BANCO POPULAR, 400 OESTE Y 25 SUR. ;;1-359181-1979;F;SANTA ANA;SANTA ANA
676;CENTRO LINGUISTICO CONVER ;108517;1/1/1900 00:00;COM;ESCUELA DE IDIOMAS;676;;;0;1;1;;337;148005000;115088;;0;URUCA, DE LA ESCUELA LA MINA 400 NORTE Y 500 ESTE. ;;1-2032252-2018;J;URUCA;SANTA ANA
683;LA CHUSPA;5529;18/1/2000 00:00;COM;TALLER;683;;;0;1;1;;917;305039000;101364;;0;POZOS, COSTADO NORTE DE HULES TECNICOS, (LA CHUSPA) ;;1-720350-1987;J;POZOS;SANTA ANA
686;LABORATORIO HERRERA ;15965;1/1/1900 00:00;COM;PERFUMERIA;686;;;0;1;1;;715;529112000;115092;;0;DE LA PULPERIA LA MINA DE ORO 57 OESTE. ;;1-353312-1979;J;URUCA;SANTA ANA
692;BARBERIA  MODESTO;7482;1/1/1900 00:00;COM;BARBERIA;692;;;0;0;1;;107;124146000;618585;;0;SANTA ANA, CENTRO, DE LA MUNICIPALIDAD 200 SUR. NOTA: REUNION FINCAS: 078259-000 (124-146-000) Y 110757-000 (124-147-000);;1-1470785-2011;F;SANTA ANA;SANTA ANA
694;PELUQUERIA HEBERT;5118;22/4/1997 00:00;COM;PELUQUERIA;694;;;0;1;1;;712;124002000;525707;;0;SANTA ANA, CENTRO, DE LA MUNICIPALIDAD 100 SUR. ;;1-656849-1986;F;SANTA ANA;SANTA ANA
708;PELUQUERIA HAIR TECH ;18769;1/1/1900 00:00;COM;SALON DE BELLEZA;708;;NL;0;1;1;;805;126134000;125154;;0;SANTA ANA, CENTRO, DE LA MUNICIPALIDAD 100 NORTE. ;;1-1557743-2012;F;POZOS;SANTA ANA
712;AUTOS CHAVA;109782;1/1/1900 00:00;COM;VENTA DE AUTOS;712;;;0;0;1;;1067;312130000;239033;;0;POZOS, DEL DEPOSITO DE MATERIALES EL LAGAR 100 NORTE. ;;1-20307-1975;F;POZOS;SANTA ANA
713;CERAMICA;1648;1/1/1900 00:00;COM;VENTA CERAMICA;713;;;0;0;1;;1030;540148000;208987;;0;FRENTE A LA INTERSECCION DE AVENIDA 06 CON CALLE 06. ;;1-217757-1994;F;SANTA ANA;SANTA ANA
717;DISEÑO EN MADERA;10108;29/7/1999 00:00;COM;ARTESANIA Y VENTA MUEBLES;717;;;0;1;1;;76;126168000;334030;;8;SANTA ANA CENTRO, DE LA MUNICIPALIDAD, 250 OESTE. ;;1-552033-1999;F;SANTA ANA;SANTA ANA
720;LA CASA DEL AZULEJO ;15978;25/7/2000 00:00;COM;VENTA ACABADOS DE CERAMICA;720;;;0;0;1;;1019;538107000;118815;;14;DE LA INTERSECCION DE RUTA NACIONAL 311 CON AVENIDA 46, 66 MTS. AL OESTE. ;;NO SE INDICA;F;SALITRAL;SANTA ANA
725;CERAMICA KATTIA;15972;3/8/1995 00:00;COM;CERAMICA;725;;NL;0;0;1;;199;538330000;171511;;10;DE LA INTERSECCION DE RUTA NACIONAL 311 CON AVENIDA 46, 119 MTS. AL OESTE. ;;1-1189678-2007;F;SALITRAL;SANTA ANA
